{
  "id": "cc-50f2c9b3",
  "front": "Advanced Persistent Threat",
  "back": "An advanced persistent threat is a long-term intrusion that attempts to gain access to specific data and information. Instead of trying to cause damage, APT attacks are designed to harvest information from the network or target.",
  "source_doc": "NIST SP 800-12 Rev 1",
  "source_section": "Section 4.1.1",
  "source_excerpt": "An advanced persistent threat is a long-term intrusion that attempts to gain access to specific data and information. Instead of trying to cause damage, APT attacks are designed to harvest information from the network or target.",
  "source_hash": "sha256:0669500e913012bf86687d9b1b362b0e64ed5e8d46a45c6ae434c537b425ce51",
  "answer_type": "verbatim",
  "primary_domain": 5,
  "secondary_domains": [],
  "status": "draft",
  "created_at": "2026-05-15T03:45:00Z",
  "modified_at": null
}
