{
  "id": "cc-8e2d3c94",
  "front": "RESPOND (CSF Function)",
  "back": "Actions regarding a detected cybersecurity incident are taken.",
  "source_doc": "NIST CSWP 29 (CSF 2.0)",
  "source_section": "Section 2",
  "source_excerpt": "Actions regarding a detected cybersecurity incident are taken.",
  "source_hash": "sha256:6cb7d28d4a97ac083289ce0709859fbe19d1fa91592dc619982a43e77cd3af2b",
  "answer_type": "verbatim",
  "primary_domain": 1,
  "secondary_domains": [
    2
  ],
  "status": "verified",
  "created_at": "2026-05-15T03:55:00Z",
  "modified_at": "2026-05-16T16:01:22Z"
}
