{
  "id": "cc-2d8c47f9",
  "front": "Occupant Emergency Plan (OEP)",
  "back": "The OEP outlines first-response procedures for occupants of a facility in the event of a threat or incident to the health and safety of personnel, the environment, or property.",
  "source_doc": "NIST SP 800-34 Rev 1",
  "source_section": "Section 2.2.8",
  "source_excerpt": "The OEP outlines first-response procedures for occupants of a facility in the event of a threat or incident to the health and safety of personnel, the environment, or property.",
  "source_hash": "sha256:ed6e7498ed46ca642dde37c00c36b8a8478e67b3327f3d61acad13a1a8e0f218",
  "answer_type": "verbatim",
  "primary_domain": 2,
  "secondary_domains": [],
  "status": "verified",
  "created_at": "2026-05-15T03:55:00Z",
  "modified_at": "2026-05-16T16:01:22Z"
}
