{
  "id": "cc-b6f4c198",
  "front": "Threat Event",
  "back": "A threat event is an incident or situation that could potentially cause undesirable consequences or impacts.",
  "source_doc": "NIST SP 800-12 Rev 1",
  "source_section": "Section 4",
  "source_excerpt": "A threat event is an incident or situation that could potentially cause undesirable consequences or impacts.",
  "source_hash": "sha256:0669500e913012bf86687d9b1b362b0e64ed5e8d46a45c6ae434c537b425ce51",
  "answer_type": "verbatim",
  "primary_domain": 1,
  "secondary_domains": [],
  "status": "verified",
  "created_at": "2026-05-15T03:45:00Z",
  "modified_at": "2026-05-16T16:01:22Z"
}
