{
  "id": "cc-d32f1c6b",
  "front": "Separation of Duties",
  "back": "Dividing mission, business, and support functions among different individuals or roles so that no single person controls a complete transaction — reducing the risk of abuse of privilege or malicious activity without collusion.",
  "source_doc": "NIST SP 800-53 Rev 5",
  "source_section": "AC-5",
  "source_chain": [],
  "source_excerpt": "Separation of duties addresses the potential for abuse of authorized privileges and helps to reduce the risk of malevolent activity without collusion. Separation of duties includes dividing mission or business functions and support functions among different individuals or roles, conducting system support functions with different individuals, and ensuring that security personnel who administer access control functions do not also administer audit functions.",
  "source_hash": "sha256:44a04031e41bb2e32fe3b8b94a2b915b0d40c8fb1f2d803e464f3c383b375d5a",
  "answer_type": "paraphrased",
  "primary_domain": 3,
  "secondary_domains": [],
  "status": "verified",
  "created_at": "2026-05-18T22:47:23Z",
  "modified_at": "2026-05-18T23:33:18Z"
}
