{
  "id": "cc-c0b539d5",
  "front": "Stateful Inspection",
  "back": "Packet filtering that also tracks the state of connections and blocks packets that deviate from the expected state.",
  "source_doc": "NIST SP 800-41 Rev 1",
  "source_section": "Appendix A — Glossary",
  "source_chain": [],
  "source_excerpt": "Packet filtering that also tracks the state of connections and blocks packets that deviate from the expected state.",
  "source_hash": "sha256:46fc63d54d9fb5275e6f94ec043203abbc8281d2cd46e704e0dada71c5fae009",
  "answer_type": "verbatim",
  "primary_domain": 4,
  "secondary_domains": [],
  "status": "draft",
  "created_at": "2026-05-19T03:43:08Z",
  "modified_at": null
}
