{
  "id": "cc-2764d31d",
  "front": "Security Domain",
  "back": "A domain that implements a security policy and is administered by a single authority.",
  "source_doc": "NIST SP 800-53 Rev 5",
  "source_section": "Appendix A",
  "source_chain": [
    "CNSSI 4009"
  ],
  "source_excerpt": "A domain that implements a security policy and is administered by a single authority.",
  "source_hash": "sha256:5aa19dd6214e8641682bc4ddf28c3cffb4e60d4d18fbaae4155dd4420cf0b8c6",
  "answer_type": "verbatim",
  "primary_domain": 3,
  "secondary_domains": [],
  "status": "verified",
  "created_at": "2026-05-18T13:04:46Z",
  "modified_at": "2026-05-18T13:05:06Z"
}
