{
  "id": "cc-f096ba97",
  "front": "Public Key Cryptography (PKC)",
  "back": "Encryption system that uses a public-private key pair for encryption and/or digital signature.",
  "source_doc": "CNSSI 4009",
  "source_section": "Terms and Definitions",
  "source_chain": [],
  "source_excerpt": "Encryption system that uses a public-private key pair for encryption and/or digital signature.",
  "source_hash": "sha256:666c24d645010d5cae0bb2f9da0c7e1d6d26cdb5e842d216526168209267464c",
  "answer_type": "verbatim",
  "primary_domain": 5,
  "secondary_domains": [],
  "status": "verified",
  "created_at": "2026-05-18T23:47:39Z",
  "modified_at": "2026-05-19T00:13:55Z"
}
