{
  "id": "cc-2533a58f",
  "front": "Proxy",
  "back": "An application that \"breaks\" the connection between client and server. The proxy accepts certain types of traffic entering or leaving a network and processes it and forwards it.",
  "source_doc": "CNSSI 4009",
  "source_section": "Terms and Definitions",
  "source_chain": [
    "NIST SP 800-44 Rev 2"
  ],
  "source_excerpt": "An application that \"breaks\" the connection between client and server. The proxy accepts certain types of traffic entering or leaving a network and processes it and forwards it.",
  "source_hash": "sha256:666c24d645010d5cae0bb2f9da0c7e1d6d26cdb5e842d216526168209267464c",
  "answer_type": "verbatim",
  "primary_domain": 4,
  "secondary_domains": [],
  "status": "draft",
  "created_at": "2026-05-18T23:47:39Z",
  "modified_at": null
}
