{
  "id": "cc-4c1d8f6b",
  "front": "System Integrity",
  "back": "The quality that a system has when it performs its intended function in an unimpaired manner, free from unauthorized manipulation of the system, whether intentional or accidental.",
  "source_doc": "NIST SP 800-12 Rev 1",
  "source_section": "Section 1.4",
  "source_chain": [
    "CNSSI 4009"
  ],
  "source_excerpt": "The quality that a system has when it performs its intended function in an unimpaired manner, free from unauthorized manipulation of the system, whether intentional or accidental.",
  "source_hash": "sha256:0669500e913012bf86687d9b1b362b0e64ed5e8d46a45c6ae434c537b425ce51",
  "answer_type": "verbatim",
  "primary_domain": 1,
  "secondary_domains": [],
  "status": "verified",
  "created_at": "2026-05-15T03:35:00Z",
  "modified_at": "2026-05-18T05:59:14Z"
}
