{
  "id": "cc-6b3f1ac0",
  "front": "Trojan Horse",
  "back": "A program that performs a desired task, but that also includes unexpected and undesirable functions.",
  "source_doc": "NIST SP 800-12 Rev 1",
  "source_section": "Section 4.1.4",
  "source_excerpt": "A program that performs a desired task, but that also includes unexpected and undesirable functions.",
  "source_hash": "sha256:0669500e913012bf86687d9b1b362b0e64ed5e8d46a45c6ae434c537b425ce51",
  "answer_type": "verbatim",
  "primary_domain": 5,
  "secondary_domains": [],
  "status": "verified",
  "created_at": "2026-05-15T03:45:00Z",
  "modified_at": "2026-05-16T16:01:22Z"
}
