{
  "id": "cc-935c5152",
  "front": "Internal Network",
  "back": "A network where the establishment, maintenance, and provisioning of security controls are under the direct control of organizational employees or contractors. Typically organization-owned, though it may be organization-controlled without being organization-owned.",
  "source_doc": "NIST SP 800-53 Rev 5",
  "source_section": "Appendix A",
  "source_chain": [],
  "source_excerpt": "A network where the establishment, maintenance, and provisioning of security controls are under the direct control of organizational employees or contractors. Cryptographic encapsulation or similar security technology implemented between organization-controlled endpoints provides the same effect (at least regarding confidentiality and integrity). An internal network is typically organization-owned yet may be organization-controlled while not being organization-owned.",
  "source_hash": "sha256:44a04031e41bb2e32fe3b8b94a2b915b0d40c8fb1f2d803e464f3c383b375d5a",
  "answer_type": "paraphrased",
  "primary_domain": 4,
  "secondary_domains": [],
  "status": "draft",
  "created_at": "2026-05-19T04:36:35Z",
  "modified_at": null
}
