{
  "id": "cc-6490e74e",
  "front": "Datagram",
  "back": "A self-contained, independent entity of data carrying sufficient information to be routed from the source to the destination computer without reliance on earlier exchanges between this source and destination computer and the transporting network.",
  "source_doc": "IETF RFC 4949",
  "source_section": "Glossary",
  "source_chain": [
    "IETF RFC 1983"
  ],
  "source_excerpt": "A self-contained, independent entity of data [i.e., a packet] carrying sufficient information to be routed from the source [computer] to the destination computer without reliance on earlier exchanges between this source and destination computer and the transporting network.",
  "source_hash": "sha256:7b42adb9c4c8a15aca42d338ec92edae59151004db21510f88e609fea9e53807",
  "answer_type": "paraphrased",
  "primary_domain": 4,
  "secondary_domains": [],
  "status": "verified",
  "created_at": "2026-05-19T03:43:08Z",
  "modified_at": "2026-05-19T04:32:34Z"
}
