{
  "id": "cc-5a865288",
  "front": "Host-Based Intrusion Detection and Prevention System (HIDS/HIPS)",
  "back": "A program that monitors the characteristics of a single host and the events occurring within that host to identify and stop suspicious activity.",
  "source_doc": "NIST SP 800-94",
  "source_section": "Appendix A — Glossary",
  "source_chain": [],
  "source_excerpt": "A program that monitors the characteristics of a single host and the events occurring within that host to identify and stop suspicious activity.",
  "source_hash": "sha256:4562ebbad30430d7ecd9aca78c165a23fbddedcb14698ad0fe46629f8cabd536",
  "answer_type": "verbatim",
  "primary_domain": 4,
  "secondary_domains": [],
  "status": "draft",
  "created_at": "2026-05-19T03:43:08Z",
  "modified_at": null
}
