{
  "id": "cc-3d9274a7",
  "front": "Application-Proxy Gateway",
  "back": "A firewall capability that combines lower-layer access control with upper layer-functionality, and includes a proxy agent that acts as an intermediary between two hosts that wish to communicate with each other.",
  "source_doc": "NIST SP 800-41 Rev 1",
  "source_section": "Appendix A — Glossary",
  "source_chain": [],
  "source_excerpt": "A firewall capability that combines lower-layer access control with upper layer-functionality, and includes a proxy agent that acts as an intermediary between two hosts that wish to communicate with each other.",
  "source_hash": "sha256:46fc63d54d9fb5275e6f94ec043203abbc8281d2cd46e704e0dada71c5fae009",
  "answer_type": "verbatim",
  "primary_domain": 4,
  "secondary_domains": [],
  "status": "draft",
  "created_at": "2026-05-19T03:43:08Z",
  "modified_at": null
}
