{
  "id": "cc-4589bd9d",
  "front": "Object",
  "back": "Passive system-related entity, including devices, files, records, tables, processes, programs, and domains that contain or receive information. Access to an object (by a subject) implies access to the information it contains.",
  "source_doc": "NIST SP 800-53 Rev 5",
  "source_section": "Appendix A",
  "source_chain": [],
  "source_excerpt": "Passive system-related entity, including devices, files, records, tables, processes, programs, and domains that contain or receive information. Access to an object (by a subject) implies access to the information it contains.",
  "source_hash": "sha256:44a04031e41bb2e32fe3b8b94a2b915b0d40c8fb1f2d803e464f3c383b375d5a",
  "answer_type": "verbatim",
  "primary_domain": 3,
  "secondary_domains": [],
  "status": "verified",
  "created_at": "2026-05-18T13:04:46Z",
  "modified_at": "2026-05-18T13:05:06Z"
}
