{
  "id": "cc-c4f7a528",
  "front": "DETECT (CSF Function)",
  "back": "Possible cybersecurity attacks and compromises are found and analyzed.",
  "source_doc": "NIST CSWP 29 (CSF 2.0)",
  "source_section": "Section 2",
  "source_excerpt": "Possible cybersecurity attacks and compromises are found and analyzed.",
  "source_hash": "sha256:6cb7d28d4a97ac083289ce0709859fbe19d1fa91592dc619982a43e77cd3af2b",
  "answer_type": "verbatim",
  "primary_domain": 1,
  "secondary_domains": [5],
  "status": "draft",
  "created_at": "2026-05-15T03:55:00Z",
  "modified_at": null
}
