{
  "id": "cc-0bb4a005",
  "front": "Symmetric Encryption Algorithm",
  "back": "Encryption algorithms using the same secret key for encryption and decryption.",
  "source_doc": "CNSSI 4009",
  "source_section": "Terms and Definitions",
  "source_chain": [
    "NIST SP 800-49"
  ],
  "source_excerpt": "Encryption algorithms using the same secret key for encryption and decryption.",
  "source_hash": "sha256:666c24d645010d5cae0bb2f9da0c7e1d6d26cdb5e842d216526168209267464c",
  "answer_type": "verbatim",
  "primary_domain": 5,
  "secondary_domains": [],
  "status": "draft",
  "created_at": "2026-05-18T23:47:39Z",
  "modified_at": null
}
