{
  "id": "cc-4a9d7f53",
  "front": "Malicious Code",
  "back": "Malicious code refers to viruses, Trojan horses, worms, logic bombs, and any other software created for the purpose of attacking a platform.",
  "source_doc": "NIST SP 800-12 Rev 1",
  "source_section": "Section 4.1.4",
  "source_excerpt": "Malicious code refers to viruses, Trojan horses, worms, logic bombs, and any other software created for the purpose of attacking a platform.",
  "source_hash": "sha256:0669500e913012bf86687d9b1b362b0e64ed5e8d46a45c6ae434c537b425ce51",
  "answer_type": "verbatim",
  "primary_domain": 5,
  "secondary_domains": [],
  "status": "draft",
  "created_at": "2026-05-15T03:45:00Z",
  "modified_at": null
}
